text;normalization
bisa kah kamu meminta tolong pad are kan sekerja untuk membantu ini;Bisakah kamu minta tolong pada rekan sekerja untuk membantu ini?
maaf apa kah aku minta dapat ijazahmu untuk ditunjukkan pad aku;Maaf, apakah aku minta dapat ijazahmu untuk ditunjukkan padaku?
bisa kah aku minta saran sehubungan dengan mas alah ini;Bisakah aku minta saran sehubungan dengan masalah ini?
terima kasih atas rekomendasi pusat belanjamu tempat belanja diluar biasa;Terima kasih atas rekomendasi pusat belanja mu, tempat belanja di luar biasa.
apa kah kamu memiliki jadwal pertandingan bola untuk tim favoritku kami hari ini;Apakah kamu memiliki jadwal pertandingan bola untuk tim favoritku kami hari ini?
jangan khawatir aku menerima tugas besok dan akan menyelesaikan nya dalam waktu yang ditentukan;Jangan khawatir, aku menerima tugas besok dan akan menyelesaikannya dalam waktu yang ditentukan.
apa kah kamu mengetahui restaurant ter baik yang menghidangkan kuliner menarik;Apakah kamu mengetahui restaurant terbaik yang menghidangkan kuliner menarik?
bisa kah kamu menemukan cara untuk meningkat kan kualitas per temuan besok;Bisakah kamu menemukan cara untuk meningkatkan kualitas pertemuan besok?
bisa kah kamu mengajarkanku setahap untuk mengatur penjadwalan hari kami seko lah;Bisakah kamu mengajarkan ku setahap untuk mengatur penjadwalan hari kau kami sekolah?
mau kamu kirim makanan pesanan ini sekitar jam setengah dua;Mau kamu kirim makanan pesanan ini sekitar jam setengah dua?
bisa kah kamu aja kaku men jemput dari rumah jam sepuluh ini;Bisakah kamu ajak aku menjemput dari rumah jam sepuluh ini?
apa kah kamu bisa member ikan saran untuk meningkat kan kualitas produk ini;Apakah kamu bisa memberikan saran untuk meningkatkan kualitas produk ini?
jangan khawatir aku membayar utang dari pad aja ringan pelanggan ini;Jangan khawatir, aku membayar utang dari pada jaringan pelanggan ini.
apa kah aku men cari sebuah bengkel ter percaya dilingkungan ini;Apakah aku mencari sebuah bengkel terpercaya di lingkungan ini?
terima kasih banyak kamu member ikan dukungan untuk proyek kamu hari ini;Terima kasih banyak, kamu memberikan dukungan untuk proyek kamu hari ini.
bisa kah kamu mengganti kan tiket per jalanan pesawatku untuk tanggal yang berbeda;Bisakah kamu mengganti tiket perjalanan pesawatku untuk tanggal yang berbeda?
maaf apa kah aku bisa mengganggumu begitu terima kasih atas waktumu;Maaf, apakah aku bisa mengganggumu begitu? Terima kasih atas waktumu.
bisa kah aku minta solusi karena aku mengalami mas alah dengan komputer ini;Bisakah aku minta solusi karena aku mengalami masalah dengan komputer ini?
maaf apa kah aku dapat bantu anmu untuk memahami instruksi pemasangan ini;Maaf, apakah aku dapat bantuanmu untuk memahami instruksi pemasangan ini?
apa kah aku bisa melihat contoh karya artistik dari pekan baru ini;Apakah aku bisa melihat contoh karya artistik dari Pekanbaru ini?
jangan lupa menyimpan resi transaksi pembelian dari pada klien ini;Jangan lupa menyimpan resi transaksi pembelian dari pada klien ini.
bisa kah aku men dapat kan dukunganmu untuk proyek ini;Bisakah aku mendapatkan dukunganmu untuk proyek ini?
apa kah kamu per nah mengunjungi tempat wisata yang indah ini;Apakah kamu pernah mengunjungi tempat wisata yang indah ini?
bisa kah aku minta saranmu untuk menu yang lezat ini;Bisakah aku minta saranmu untuk menu yang lezat ini?
terima kasih banyak atas ban tuan kamu dalam mas alah ini;Terima kasih banyak atas bantuan kamu dalam masalah ini.
bisa kah aku minta tolong men dapat kan informasi ten tang pesta unik ini;Bisakah aku minta tolong mendapatkan informasi tentang pesta unik ini?
maaf aku akan datang sedi kit telah dipanggil untuk pekerjaan lain;Maaf, aku akan datang sedikit telah dipanggil untuk pekerjaan lain.
apa kah kamu tahu berita ten tang keberadaan rumah sakit baru ini;Apakah kamu tahu berita tentang keberadaan rumah sakit baru ini?
bisa kah kamu memberikanku contoh latihan yang lebih menantang;Bisakah kamu memberikan ku contoh latihan yang lebih menantang?
terima kasih aku tidak akan lupa mengucapkan terima kasih kepadamu;Terima kasih, aku tidak akan lupa mengucapkan terima kasih kepadamu.
jangan khawatir aku telah memikirkan rencana kepergian ini;Jangan khawatir, aku telah memikirkan rencana kepergian ini.
bisa kah aku meminta informasi mengenai transportasi umum ini;Bisakah aku meminta informasi mengenai transportasi umum ini?
harimu juga tugas anaku dalam upaya membuat sebuah aplikasi mobile;Hari ini juga tugas aku dalam upaya membuat sebuah aplikasi mobile.
bisa kamu membantu saya mengorganisasi kan acara mas ayang akan segera diadakan;Bisakah kamu membantu saya mengorganisasi acara masa yang akan segera diadakan?
maaf sebelum nya tanya kan kerumah sakit nya yang dekat dimana saya akan periksa kan dokter gigi;Maaf sebelumnya, tanyakan ke rumah sakitnya yang dekat di mana saya akan periksa dokter gigi.
apa kah kamu akan hadir pada seminar ter baru ten tang kecerdasan buatan bulan ini sesuai jadwal yang tercantum;Apakah kamu akan hadir pada seminar terbaru tentang kecerdasan buatan bulan ini sesuai jadwal yang tercantum?
bisa kah kamu member ikan saran ter baik untuk membeli kan souvenir per nikah andari keluargaku dengan biaya yang ter batas;Bisakah kamu memberikan saran terbaik untuk membelikan souvenir pernikahan dari keluarga ku dengan biaya yang terbatas?
apa kah kamu akan memiliki waktu libur dia kiri kanan kam udi akhir pekan ini;Apakah kamu akan memiliki waktu libur di akhir kanan kamu di akhir pekan ini?
tanya kan pada resepsionis apa kah mereka sudah melakukan reservasi ruangan untuk per temuan bis nis minggu depan;Tanyakan pada resepsionis apakah mereka sudah melakukan reservasi ruangan untuk pertemuan bisnis minggu depan?
apa kah kamu mengerti instruksi dari supir kapal ini untuk men jalan kan prosedur keamanan;Apakah kamu mengerti instruksi dari supir kapal ini untuk menjalankan prosedur keamanan?
berita ten tang sebuah penemuan ter baru terhadap kelangsungan hidup makhluk laut telah menarik perhatian banyak orang;Berita tentang sebuah penemuan terbaru terhadap kelangsungan hidup makhluk laut telah menarik perhatian banyak orang.
tanya kan pada dosen apa kah aku membutuhkan buku tambahan untuk mata kuliah ini;Tanyakan pada dosen apakah aku membutuhkan buku tambahan untuk mata kuliah ini?
boleh kah aku mengajukan permohonan khusus untuk cuti akademik bulan ber ikut nya;Bolehkah aku mengajukan permohonan khusus untuk cuti akademik bulan berikutnya?
apa kah kamu ber encana men jalan kan marathon tahun ini untuk penggalangan dana;Apakah kamu berencana menjalankan marathon tahun ini untuk penggalangan dana?
terima kasih banyak kamu dengan sabar ber komunikasi dengan saya;Terima kasih banyak kamu dengan sabar berkomunikasi dengan saya.
jangan lupa menyiapkan peralatan dan bahanbahanya sebelum memulai memasak;Jangan lupa menyiapkan peralatan dan bahan-bahanya sebelum memulai memasak.
apa kah sudah waktu nya kamu melakukan backup data dan file penting kam udi komputer;Apakah sudah waktunya kamu melakukan backup data dan file penting kamu di komputer?
bisa kah kamu men unjuk kan cara penggunaan per angkat luna kini;Bisakah kamu menunjukkan cara penggunaan perangkat lunak ini?
maaf apa kah aku bisa meminta salinan dokumen ini darimu;Maaf, apakah aku bisa meminta salinan dokumen ini darimu?
bisa kah kamu membantuku konfirmasi kan jadwal per temuan besok;Bisakah kamu membantu ku konfirmasikan jadwal pertemuan besok?
apa kah kamu memiliki kata sandi wifi tur ter baru dalam per angkat kamu;Apakah kamu memiliki kata sandi WiFi fitur terbaru dalam perangkat kamu?
bantu anmu untuk melakukan per jalanan ini benar benar membantuku;Bantuanmu untuk melakukan perjalanan ini benar-benar membantuku.
bisa kah kamu memberikanku saran dalam memilih baju ter baru dari mereka;Bisakah kamu memberikan saran dalam memilih baju terbaru dari mereka?
apa kah and ayang ter baik dalam memecah kan mas alah ini;Apakah anda yang terbaik dalam memecahkan masalah ini?
boleh kah aku min tama film tipe ter baik yang harusku ditononkan;Bolehkah aku minta film tipe terbaik yang harus ku ditononkan?
bisa kah kamu memberikanku saran jadwal konser musim panas ini;Bisakah kamu memberikan saran jadwal konser musim panas ini?
jangan tinggal kan aku mengingatkanku dengan kartu yang kamu ber ikan pad aku;Jangan tinggalkan aku mengingatkan ku dengan kartu yang kamu berikan padaku.
apa kah kamu mengatur jam kumpul kelompok kamu pada hari kami hari ini;Apakah kamu mengatur jam kumpul kelompok kamu pada hari kami hari ini?
jangan kau ingat kan aku menyampaikan pesan kepada teman kamu ini;Jangan kau ingatkan aku menyampaikan pesan ke pada temankamu ini.
bisa kah kamu membantu saya memilih perlengkapan kamu besok ini;Bisakah kamu membantu saya memilih perlengkapan kamu besok ini?
maaf apa kah kamu aku member ikan bocoran jawa ban utuk soal ujian ini;Maaf, apakah kamu aku memberikan bocoran jawaban utuk soal ujian ini?
maaf apa kah kamu bisa member ikan saran untuk pilihan warna dinding rumahku;Maaf, apakah kamu bisa memberikan saran untuk pilihan warna dinding rumahku?
apa kah kamu akan sia pun tuk pertandingan seko lah basket nanti ini;Apakah kamu akan siap untuk pertandingan sekolah basket nanti ini?
apa kah kamu akan sangat ber hati hati untuk menyeberang jalan pada jam sibu kini;Apakah kamu akan sangat berhati-hati untuk menyeberang jalan pada jam-sibuk ini?
terima kasih banyak karena anda seorang teman baik aku dapat mengandalkanmu;Terima kasih banyak karena anda seorang teman baik, aku dapat mengandalkanmu.
maaf aku minta anda pat men jelas kan lagi detail ten tang cara pemesanan makanan online;Maaf, aku minta and dapat menjelaskan lagi detail tentang cara pemesanan makanan online.
apa kah kamu akan datang kepertemuan baru ini berkaitan terkait projek kami;Apakah kamu akan datang ke pertemuan baru ini berkaitan terkait projek kami?
apa kah kamu bisa meminta tolong pad aku untuk menyampulkan surat ini;Apakah kamu bisa meminta tolong pada ku untuk menyampulkan surat ini?
berita ter kini mengenai sudah dicapai tinggi kasus penyakit menular masyarakat;Berita terkini mengenai sudah dicapai tinggi kasus penyakit menular masyarakat.
jangan dikeluarkan dari rumah hingga penyemprotan ini masih menyala;Jangan keluarkan dari rumah hingga penyemprotan ini masih menyala.
jangan dikira aku tidak memperhatikan apa yang kamu laku kan sepanjang waktu ber ikut;Jangan dikira aku tidak memperhatikan apa yang kamu lakukan sepanjang waktu berikut.
terima kasih banyak karena sudah mengingat kan aku terhadap rapat besok;Terima kasih banyak karena sudah mengingatkan aku terhadap rapat besok.
bisa kah kamu aja kaku melakukan olahraga ikut besok pagi;Bisakah kamu ajak aku melakukan olahraga ikut besok pagi?
bisa kah kamu member ikan pendapat kritis untuk proyek aku besar ini;Bisakah kamu memberikan pendapat kritis untuk proyek aku besar ini?
cepat bawa pakaian renang karena pool kesini;Cepat, bawa pakaian renang karena pool ke sini.
bisa kah kamu membantu saya memperbaiki dokumen ini;Bisakah kamu membantu saya memperbaiki dokumen ini?
sebagai teman kamu yang baik bisa kah aku meminta anteruskan buk uku pada;Sebagai teman kamu yang baik, bisakah aku minta anteruskan buku ku pada
apa kah kamu akan keluar untuk sebentar ini;Apakah kamu akan keluar untuk sebentar ini?
bisa kah kamu men unjuk kan cara pemesanan tiket pesawat secara online;Bisakah kamu menunjukkan cara pemesanan tiket pesawat secara online?
cerita ini diadakan diceritakan kepada orang tua anda;Cerita ini akan diceritakan kepada orang tua anda.
tanya kan pada sopir bisa apa kah aku men dapat kan pengantar kemal ini;Tanyakan pada sopir bisa apakah aku mendapatkan pengantar ke mal ini?
bisa kah aku meminjam buk uku yang direkomendasikan oleh teman;Bisakah aku meminjam buku yang direkomendasikan oleh teman?
sejauh ini apa kah kamu aku ber hasil memecah kan mas alah itu;Sejauh ini, apakah kamu sudah berhasil memecahkan masalah itu?
maaf bisa kah kamu member ikan sedi kit waktu lagi;Maaf, bisakah kamu memberikan sedikit waktu lagi?
berita ter kini dilaporkan bahwa sebuah tim medis hewan ber hasil menyembuhkan sang pasien;Berita terkini dilaporkan bahwa sebuah tim medis hewan berhasil menyembuhkan sang pasien.
bisa kah kamu memperbarui data dalam basis data kamu bulan ini kah;Bisakah kamu memperbarui data dalam basis data kamu bulan ini?
hanya kamu yang bisa ingat kan aku jadwal per temuan besok;Hanya kamu yang bisa ingatkan aku jadwal pertemuan besok.
bisa kah aku bergabung dengan kelompok study kamu untuk mempersiapkan ujian ini;Bisakah aku bergabung dengan kelompok study kamu untuk mempersiapkan ujian ini?
apa kah kamu mengetahui surat pemberitahuan ten tang perubahan alamat kantor;Apakah kamu mengetahui surat pemberitahuan tentang perubahan alamat kantor?
apa kah kamu memiliki waktu luang untuk membicarakan perubahan rencana ini;Apakah kamu memiliki waktu luang untuk membicarakan perubahan rencana ini?
terima kasih atas bantu anmu dalam memperbaiki komputer saya;Terima kasih atas bantuanmu dalam memperbaiki komputer saya.
jangan lupa men anya kan kamu ter baru ten tang pencapaian diantara;Jangan lupa menanyakan kamu terbaru tentang pencapaian diantara.
apa kah kamu mau ikutan kelas bahasa inggris daring yang diselenggarakan;Apakah kamu mau ikutan kelas bahasa Inggris daring yang diselenggarakan?
maaf apa kah kamu bisa memperjelas aturan pemakaian dalam aplikasi ini;Maaf, apakah kamu bisa memperjelas aturan pemakaian dalam aplikasi ini?
bisa kah kamu membantu aku memperbaiki tata letak kamar main kam udi atas;Bisakah kamu membantu aku memperbaiki tata letak kamar main kamu di atas?
jangan kau khawatir aku pasti selalu membantumu melihat cerita ter sebut;Jangan kau khawatir, aku pasti selalu membantu mu melihat cerita tersebut.
bisa kah kamu mengajariku pengetahuan ten tang pertanian organik ini;Bisakah kamu mengajari aku pengetahuan tentang pertanian organik ini?
apa kah kamu mau kut unjuk kan tempat parkir untuk menghindari keramaian;Apakah kamu mau kutunjukkan tempat parkir untuk menghindari keramaian?
terima kasih aku meminta bantu anmu untuk melakukan per sia pan kelompok ini;Terima kasih aku minta bantuanmu untuk melakukan persiapan kelompok ini.
tolong hingga kamu terima berita ini tidak bocor kepada siapa pun;Tolong hingga kamu terima berita ini tidak bocor ke siapapun.
bagaimana cara kerja bis nis itu apa kan kamu cari kan penghasilan lain;Bagaimana cara kerja bisnis itu? Apa kamu akan cari kan penghasilan lain?
bisa kah aku membantu kamu mengatur jadwal per temuan untuk pekerja anter sebut;Bisakah aku membantu kamu mengatur jadwal pertemuan untuk pekerjaan tersebut?
apa kah kamu dapat mengantarku sampai menuju sibawah;Apakah kamu dapat mengantarkan aku sampai menara sibawah?
jangan lupa menyambut penumpang dengan ramah dan senang;Jangan lupa menyambut penumpang dengan ramah dan senang.
berita penting ter kini terkait dengan suara menara dalam pelaksanaan pemilu;Berita penting terkini terkait dengan suara menara dalam pelaksanaan pemilu.
bisa kah aku minta and atidak menyalahkan aku dalam mas alah ini;Bisakah aku minta anda tidak menyalahkan aku dalam masalah ini?
apa kah kamu bisa memberikanku saran kelompok buku yang bagus;Apakah kamu bisa memberikan saran kelompok buku yang bagus?
apa kah aku dapat meminta pendapat kalian untuk proyek kami;Apakah aku dapat meminta pendapat kalian untuk proyek kami?
tolong bicara lah dengan lembut dan pengertian terkait mas alah ini;Tolong bicara lah dengan lembut dan pengertian terkait masalah ini.
apa kah kamu dapat membantuku konfirmasi kan jadwal pertandingan ini;Apakah kamu dapat membantu ku konfirmasikan jadwal pertandingan ini?
bisa kah kamu memberikanku petunjuk bagaimana cara menggunakan aplikasi ber basis cloud ini;Bisakah kamu memberikanku petunjuk bagaimana cara menggunakan aplikasi berbasis cloud ini?
apa kah kamu dapat membantu kurekomendasikan mereka kamera foto ter baik untuk fotografi;Apakah kamu dapat membantu kurekomendasikan merek kamera foto terbaik untuk fotografi?
terima kasih banyak aku dapat menyewa apartemen dimana aku dapat menginap semalam;Terima kasih banyak, aku dapat menyewa apartemen di mana aku dapat menginap semalam.
apa kah buku mengandung panduan yang jelas dan mudah dimengerti dalam memasak;Apakah buku ini mengandung panduan yang jelas dan mudah dimengerti dalam memasak?
bisa kah aku mengundang teman temanku kemalam untuk pesta untuk merayakan ulang tahunku;Bisakah aku mengundang teman-temanku kemalam untuk pesta untuk merayakan ulang tahunku?
apa kah kamu menyukai musik rock atau jenis dengan tempo cepat seperti punk rock;Apakah kamu menyukai musik rock atau jenis dengan tempo cepat seperti punk rock?
apa kah kamu bisa meminta harga spesial untuk pesan makanan untuk kumpulan kelasku;Apakah kamu bisa meminta harga spesial untuk pesan makanan untuk kumpulan kelasku?
jangan kamu men cari cari tempat yang nya man dan ramah dilingkungan perkebunan untuk ber libur;Jangan kamu mencari tempat yang nyaman dan ramah dilingkungan perkebunan untuk berlibur.
bisa kah aku meminta direktori film ter kenal untuk menyutradarai sutradaraan dengan film ter bar uku;Bisakah aku minta direktori film terkenal untuk menyutradarai sutradaraan dengan film terbaruku?
apa kah kamu mauku member ikan rekomendasi buku yang membantu saya meningkat kan keahlian menu lis;Apakah kamu mau ku memberikan rekomendasi buku yang membantu saya meningkatkan keahlian menulis?
apa kah kau ingin bergabung dalam perayaan keluarga kamu besarbesaran ini;Apakah kau ingin bergabung dalam perayaan keluarga kami besar-besaran ini?
bisa kah kamu bantu saya mengatur jadwal pertandingan kam udi akhir pekan ini;Bisakah kamu membantu saya mengatur jadwal pertandingan kamu di akhir pekan ini?
maaf apa kah aku dapat meminta salin denganmu dalam proyek ini ber ikut nya;Maaf, apakah aku dapat minta salinan denganmu dalam proyek ini berikutnya?
apa aku kamu bisa men dapat kan diskon khusus untuk pembelian bar ang ini;Apa aku kamu bisa mendapatkan diskon khusus untuk pembelian barang ini?
terima kasih banyak aku telah men dapat ban tuan luar biasa darimu;Terima kasih banyak, aku telah mendapat bantuan luar biasa dari kamu.
bisa kah kamu memberikanku tips dan trik untuk meningkat kan kemampuan bahasa kam udi waktu untuk ujian;Bisakah kamu memberikan tips dan trik untuk meningkatkan kemampuan bahasa kamu di waktu untuk ujian?
apa kah buk udi sudah aku kembali kan kedalam kotak koleksi perpus ata sebentar lagi;Apakah buku di sudah aku kembalikan ke dalam kotak koleksi perpustakaan sebentar lagi?
bisa kah kamu aja kaku untuk mengunjungi sebuah pertunjukan kebudayaan disini;Bisakah kamu ajak aku untuk mengunjungi sebuah pertunjukan kebudayaan di sini?
maaf apa kah aku minta ter lambat buku menginginkan lulus transpormasi tambahan;Maaf, apakah aku minta terlambat buku, menginginkan lulus transpormasi tambahan.
bisa kah kamu membantuku ten tang cara kembali untuk mengambil bukumu milidisesekolah ini;Bisakah kamu membantu ku tentang cara kembali untuk mengambil buku mu milidisesekolah ini?
terima kasih banyak karena bantu anmu untuk menyelesaikan permasalahan kamu hari ini;Terima kasih banyak karena bantuanmu untuk menyelesaikan permasalahan kamu hari ini.
apa kau jadi keluar ber sama kamu hari kami senin besok;Apakah kamu jadi keluar bersama aku hari kamis ini?
terima kasih banyak kak aku dapat mengganti kan aku men jalan kan peran anku;Terima kasih banyak, kak aku dapat menggantikan aku menjalankan perananku.
jangan lupa mengingatku saat ada lah waktu pengingatan makan malam;Jangan lupa mengingatkan ku saat adalah waktu pengingatan makan malam.
apa kah aku dapat meminta bantu anmu dalam menyelidiki kerusakan lampu rumah;Apakah aku dapat meminta bantuanmu dalam menyelidiki kerusakan lampu rumah?
terima kasih banyak atas ban tua nya memilih kost yang sesuai tingkat anku;Terima kasih banyak atas bantuanya memilih kost yang sesuai tingkatanku.
jangan ganti reksa aku tidak dapat menahan kamu ber bicara denganku;Jangan ganti reksa aku tidak dapat menahan kamu berbicara dengan aku.
apa kah aku men dapat kesempatan untuk meminta informasi darimu;Apakah aku mendapat kesempatan untuk meminta informasi darimu?
terima kasih aku sangat menghargai dukungan dan semangat darimu;Terima kasih, aku sangat menghargai dukungan dan semangat darimu.
bisa kah kamu membantu saya memahami secara lebih baik mengenai tugas ini;Bisakah kamu membantu aku memahami secara lebih baik mengenai tugas ini?
maaf sebelum nya saya telah membooking tempat dudukmu;Maaf sebelumnya, saya telah membooking tempat dudukmu.
bisa kah aku minta anda pat membantu ten tang per sia pan presentasi besok;Bisakah aku minta anda dapat membantu tentang persiapan presentasi besok?
bisa kah kamu mengantarku ter dekat dengan tempat pekerjaan kamu;Bisakah kamu mengantarku terdekat dengan tempat pekerjaan kamu?
apa kah aku membutuhkan saran darimu untuk memilih busana yang tepat untuk acara ini;Apakah aku membutuhkan saran dari mu untuk memilih busana yang tepat untuk acara ini?
apa kah kamu menyediakan paket wisata ter baik untuk keluarga kami;Apakah kamu menyediakan paket wisata terbaik untuk keluarga kami?
bisa kah kamu mengajari aku ada ber ken dara andi motor;Bisakah kamu mengajari aku ada berkendaraan di motor?
apa kah kamu tahu mengenai ter baru buku yang layak dibaca;Apakah kamu tahu mengenai terbaru buku yang layak dibaca?
maaf aku memerlukan ban tuan kamu mengangkat bar ang berat ini;Maaf aku memerlukan bantuan kamu mengangkat barang berat ini.
jangan tinggal kan aku teman teman sebaya ter lebih dahulu;Jangan tinggalkan aku, teman-teman sebaya terlebih dahulu.
maaf aku sudah menyimpan bukumu begitu banyak waktu;Maaf, aku sudah menyimpan buku mu, begitu banyak waktu.
bisa kah aku min tau saran darimu dalam memilih kamera yang bagus;Bisakah aku minta saran darimu dalam memilih kamera yang bagus?
jangan khawatir kan kamu han yah arus men coba nya untuk men capai yang ter baik;Jangan khawatir, kamu hanya harus mencobanya untuk mencapai yang terbaik.
terima kasih banyak aku dapat mengandalkan kam udi waktu yang sulit ini;Terima kasih banyak, aku dapat mengandalkan kamu di waktu yang sulit ini.
apa kah aku member ikan bantu anmu dalam mengerjakan proyek kantor ini;Apakah aku memberikan bantuanmu dalam mengerjakan proyek kantor ini?
bisa kah aku member ikan petunjuk arah untuk menuju tempat ini;Bisakah aku memberikan petunjuk arah untuk menuju tempat ini?
terima kasih atas bantu anmu dalam menyelesaikan pekerjaan rumah;Terima kasih atas bantuanmu dalam menyelesaikan pekerjaan rumah.
apa kah aku men dapat kah cuti segar kesempatan kali ini;Apakah aku mendapatkan kulit segar kesempatan kali ini?
bisa kah kamu aja kaku mengunjungi tempat pariwisata ter kenal disini sebentar lagi;Bisakah kamu ajak aku mengunjungi tempat pariwisata terkenal di sini sebentar lagi?
terima kasih aku minta bantu anmu dalam menyiapkan dokumen penting ini;Terima kasih aku minta bantuanmu dalam menyiapkan dokumen penting ini.
apa kah kamu akan mengajar kan kam ubah asa inggris kelas kamu;Apakah kamu akan mengajarkan kamu bahasa Inggris kelasmu?
bisa kah kamu aja kaku makan malam diluar dengan pemandangan indah;Bisakah kamu ajak aku makan malam diluar dengan pemandangan indah?
apa kah kamu akan hadiri pada acara hari kedua jam setelah ini;Apakah kamu akan hadir pada acara hari kedua jam setelah ini?
bisa kah kamu mengantarku dari mall ini aku tidak bawa mobil dini;Bisakah kamu mengantarkan ku dari mall ini, aku tidak bawa mobil ini.
bisa kah kamu aja kaku menemukan lokasi ter baik untuk makan malam;Bisakah kamu ajak aku menemukan lokasi terbaik untuk makan malam?
maaf sebelum nya apa kah kamu tahu apa yang ter jadi pada mobilku;Maaf sebelumnya, apakah kamu tahu apa yang terjadi pada mobilku?
bisa kah kamu men jelas kan instruksi penting ini untuk kami semua;Bisakah kamu menjelaskan instruksi penting ini untuk kami semua?
terima kasih atas perhatian dan masukan kamu yang ber harga ten tang projek kamu mini;Terima kasih atas perhatian dan masukan kamu yang berharga tentang proyek kamu ini.
jangan lupa menyewa mobil untuk libur anmu agar lebih nya man dan kenyamanan;Jangan lupa menyewa mobil untuk liburanmu agar lebih nyaman dan kenyamanan.
terima kasih atas bantu anmu kamu dalam menyiapkan dan meluncurkan proyek ini;Terima kasih atas bantuan kamu dalam menyiapkan dan meluncurkan proyek ini.
bisa kah kamu menyediakan informasi ten tang jalan ter pendek dan ter cepat menuju sendiri kota ini;Bisakah kamu menyediakan informasi tentang jalan terpendek dan tercepat menuju sendiri kota ini?
apa kah aku men dapat kan saranmu untuk meningkat kan kemampuan bahasa ini;Apakah aku mendapatkan saranmu untuk meningkatkan kemampuan bahasa ini?
jangan lupa meminta terima kasih kamu untuk ban tuan kamu dalam mengerjakan tugas rumah;Jangan lupa meminta terima kasih kamu untuk bantuan kamu dalam mengerjakan tugas rumah.
bisa kah kamu aja kaku untuk mengunjungi bengkelmu untuk memeriksa kan ken dara anku;Bisakah kamu ajak aku untuk mengunjungi bengkelmu untuk memeriksa kendaraanku?
apa kah kamu tahu ten tang perubahan jadwal penerbang andari maskapital;Apakah kamu tahu tentang perubahan jadwal penerbangan dari maskapital?
terima kasih atas informasi dari surat dan bar ang baru yang kamu antar kan kepadaku;Terima kasih atas informasi dari surat dan barang baru yang kamu antarkan kepadaku.
ayo cepat ber angkat kamu ketinggalan pesawat nya;Ayo, cepat berangkat! Kamu ketinggalan pesawatnya.
apa kah bisa dimasukkan kucing kesini dalam kandang;Apakah bisa dimasukkan kucing ke sini dalam kandang?
terima kasih atas ban tuan darimu pada waktu yang ingin sulit ini;Terima kasih atas bantuan darimu pada waktu yang ingin sulit ini.
bisa kah kamu mengganti kan kunci rumahku yang hilang;Bisakah kamu menggantikan kunci rumahku yang hilang?
bisa kah aku ber tanya ten tang cara pemakaian dari aplikasi ter baru;Bisakah aku bertanya tentang cara pemakaian dari aplikasi terbaru?
