text;normalization
terima kasih banyak atas waktu dan per hati anmu untuk kegiatan ini;Terima kasih banyak atas waktu dan perhatianmu untuk kegiatan ini.
apa kah kamu membantu kucari kan direktor ter baru dari per usahaan ini;Apakah kamu membantu ku mencarikan direktor terbaru dari perusahaan ini?
jangan kau khawatir aku tidak sedih melihat perpisahan kita;Jangan khawatir, aku tidak sedih melihat perpisahan kita.
apa kah aku dapat men dapat kan bantu anmu untuk memperbaiki mesin ken dara anku;Apakah aku dapat mendapatkan bantuanmu untuk memperbaiki mesin kendaraanku?
bisa kah aku meminta alat musik darimu untuk pertunjukan mala mini;Bisakah aku minta alat musik darimu untuk pertunjukan malam ini?
terima kasih banyak atas keberanianmu untuk mengatakan kenyataan ini;Terima kasih banyak atas keberanianmu untuk mengatakan kenyataan ini.
bisa kah kamu memberi tahu kan jadwal konser ter baru band favorit ini;Bisakah kamu memberitahukan jadwal konser terbaru band favorit ini?
terima kasih banyak kamu akan telah mengantarku sampai tujuan ter dekat;Terima kasih banyak, kamu akan telah mengantarku sampai tujuan terdekat.
jangan khawatir aku sudah mengambil pesanan kamu ter lebih dahulu lagi;Jangan khawatir, aku sudah mengambil pesanan kamu terlebih dahulu lagi.
jangan lupa menyimpan catatan pentingmu untuk kemudian waktu nanti;Jangan lupa menyimpan catatan pentingmu untuk kemudian waktu nanti.
apa kah aku minta buku mengembalikan sepedaku sementara waktu ini;Apakah aku minta kamu mengembalikan sepedaku sebelum waktu ini?
bisa kah kamu membantu saya dalam memperbaharui sistem operasi komputer;Bisakah kamu membantu saya dalam memperbaharui sistem operasi komputer?
maaf apa kah aku dapat izin menggunakan kursi kantormu ter kemarin;Maaf, apakah aku dapat izin menggunakan kursi kantor mu terkemarin?
jangan tinggal kan aku menginginkan menonton film ter baru ini;Jangan tinggalkan aku, menginginkan menonton film terbaru ini.
bisa kah kamu aja kaku mengunjungi tempat wisata populer disini;Bisakah kamu ajak aku mengunjungi tempat wisata populer di sini?
apa kah aku dapat membantu kamu men dapat kan saran dari profesional ini;Apakah aku dapat membantu kamu mendapatkan saran dari profesional ini?
jangan khawatir aku akan mengingat kan ten tang per temuan besok;Jangan khawatir, aku akan mengingatkan tentang pertemuan besok.
hai sophia apa kah kau ingin kan terlibat kah aku pada proyek ter barumu;Hai Sophia, apakah kau ingin terlibatkah aku pada proyek terbarumu?
bisa kah aku mengucapkan terima kasih banyak atas bantu anmu;Bisakah aku mengucapkan terima kasih banyak atas bantuanmu.
apa kah aku kamu boleh mengajar kan ten tang cara memasak makanan ini;Apakah aku kamu boleh mengajarkan tentang cara memasak makanan ini?
bisa kah aku minta harga tiket tiket bis turun selama ini dalam per jalanan;Bisakah aku minta harga tiket bis turun selama ini dalam perjalanan?
terima kasih banget karena telah menemaniku dalam acara kami kerja ini;Terima kasih banget karena telah menemaniku dalam acara kerja ini.
boleh kah aku meminta himbauanmu untuk menggunakan per angkat lunak baru ter sebut;Bolehkah aku meminta himbauanmu untuk menggunakan perangkat lunak baru tersebut?
maaf apa kah aku mengganggumu untuk men anya kan pendapatmu untuk ide proyek ini;Maaf, apakah aku mengganggumu untuk menanyakan pendapatmu untuk ide proyek ini?
apa kah aku bisa membantu kamu untuk mengorganisir rapat besok ini;Apakah aku bisa membantu kamu untuk mengorganisir rapat besok ini?
hai selamat pagi kawan kawan semua apa kah kalian ingin bergabung dalam projek sama ini;Hai, selamat pagi kawan-kawan semua, apakah kalian ingin bergabung dalam proyek sama ini?
apa kah kamu tahu apa ter baru ten tang film favorit kam udi mala mini;Apakah kamu tahu apa terbaru tentang film favorit kamu di malam ini?
apa kah kamu ada plan untuk liburan kan kamu;Apakah kamu ada rencana untuk liburan kamu?
bisa kah aku meminjam paket tanda tangan kamu;Bisakah aku meminjam paket tanda tangan kamu?
terima kasih atas ban tuan kamu dalam menyelesaikan proyek ini;Terima kasih atas bantuan kamu dalam menyelesaikan proyek ini.
apa kah aku dapat chat denganmu untuk informasi sebentar;Apakah aku dapat chat denganmu untuk informasi sebentar?
bisa kah kamu membantu terima kasih karena hadiah kamu;Bisakah kamu membantu? Terima kasih karena hadiah kamu.
minta per hitungan biaya kepadaku untuk liburan kelas kami;Mintakan perhitungan biaya kepadaku untuk liburan kelaskami.
bisa kah kamu aja kaku menemukan tempat parkir yang ter sedia;Bisakah kamu ajak aku menemukan tempat parkir yang tersedia?
terima kasih atas waktu dan per hati anmu untuk proyek kami;Terima kasih atas waktu dan perhatianmu untuk proyek kami.
maaf apa kah aku dapat pinjam sebentar komputer kamu;Maaf, apakah aku dapat pinjam sebentar komputer kamu?
apa kah kamu tahu men jalan kan ritual untuk tahun baru yang baru;Apakah kamu tahu menjalankan ritual untuk tahun baru yang baru?
apa kah kamu mau ikut ber sama dalam per jalanan ini;Apakah kamu mau ikut bersama dalam perjalanan ini?
bisa kah aku minta gambar kamu dari teman baik bambosetim;Bisakah aku minta gambar kamu dari teman baik bambosetim?
bisa kah kamu aja kaku makan malam ber sama diluar rumah ini;Bisakah kamu ajak aku makan malam bersama di luar rumah ini?
apa kah kamu tahu mengenai gadget ter baru ini;Apakah kamu tahu mengenai gadget terbaru ini?
jangan lupa menyimpan barangmu ini tempat yang aman sebelum pergi;Jangan lupa menyimpan barangmu ini di tempat yang aman sebelum pergi.
bisa kah aku minta informasi ten tang penerbangan tujuan ini;Bisakah aku minta informasi tentang penerbangan tujuan ini?
maaf apa kah kamu memiliki waktu libur beber apa izin aku ikut dalam per jalanan ini;Maaf, apakah kamu memiliki waktu libur beberapa izin aku ikut dalam perjalanan ini?
jangan khawatir aku dapat melakukan proses instalasi seperti yang aku minta kan;Jangan khawatir, aku dapat melakukan proses instalasi seperti yang aku minta kan.
bisa kah kamu membantuku men cari kan kalender untuk acara kamu ter dekat;Bisakah kamu membantu aku mencarikan kalender untuk acara kamu terdekat?
terima kasih aku minta bantu anmu untuk menyelesaikan mas alah ini;Terima kasih, aku minta bantuanmu untuk menyelesaikan masalah ini.
pukul anter sebut begitu ber bahaya bagiku;Pukulan tersebut begitu berbahaya bagiku.
bisa kah aku meminta bantu anmu saat merakit perabotan ini;Bisakah aku minta bantuanmu saat merakit perabotan ini?
apa kah kamu dapat men jelas kan cara menggunakan fitur ter baru dari per angkat ini;Apakah kamu dapat menjelaskan cara menggunakan fitur terbaru dari perangkat ini?
jangan lupa menyimpan kunci kamu rumahku agar aman aman;Jangan lupa menyimpan kunci kamurumahku agar aman.
bisa kah aku minta izin untuk menggunakan kendaraan ini menempuh per jalanan jauh;Bisakah aku minta izin untuk menggunakan kendaraan ini menempuh perjalanan jauh?
bisa kah kamu member ikan kualifikasi ter baru dari kandidat perekrutan ini;Bisakah kamu memberikan kualifikasi terbaru dari kandidat perekrutan ini?
apa kah buku sudah disortir sesuai dengan dewey decimal classification;Apakah buku sudah disortir sesuai dengan Dewey Decimal Classification?
jangan serius aku mengerti berita ini ter baru;Jangan serius, aku mengerti berita ini terbaru.
bisa kah kamu membantu kucari caramu dalam menyelesaikan permasalahan ini;Bisakah kamu membantu ku cari cara mudah dalam menyelesaikan permasalahan ini?
bisa kah kamu membantuku review draft proposal proyek ini;Bisakah kamu membantu ku review draft proposal proyek ini?
apa kah aku men dapat kesempatan untuk menghadiri pertunjukan musik ter bar udi mall ini;Apakah aku mendapat kesempatan untuk menghadiri pertunjukan musik terbaru di mall ini?
jangan lupa menghitung total belanjamu sebelum meninggal kan toko kasir;Jangan lupa menghitung total belanja mu sebelum meninggalkan tokokasir.
terima kasih aku minta mohon maaf untuk kesalahpahaman tadi;Terima kasih, aku minta maaf untuk kesalahpahaman tadi.
boleh kah aku minta kirim salammu untuk orang tuaku;Bolehkah aku minta kiriman salammu untuk orang tuaku?
apa kah kamu bisa membantuku hitung total belanjaan ini;Apakah kamu bisa membantu ku hitung total belanjaan ini?
maka sih banget buat saranmu untuk film seru ber judul itu;Makasih banget buat saranmu untuk film seru berjudul itu.
boleh kah aku menggunakan kursi perpustakaan untuk belajar sementara;Bolehkah aku menggunakan kursi perpustakaan untuk belajar sementara?
terima kasih aku min tamu untuk ban tuan mereka untuk membangun rumah sakit;Terima kasih aku minta mu untuk bantuan mereka untuk membangun rumah sakit.
abang dengan santai datang kap anter baru berita ini;Abang dengan santai dapat kapan terbaru berita ini.
maaf aku bisa kah aku meminjam uang darimu pada ingin;Maaf, aku bisa kamu pinjam uang dari mu pada ingin.
tanya kamu pad anya sudah kah aku mengembalikan buku yang aku ambil;Tanyakan kamu pada nya, sudahkah aku mengembalikan buku yang aku ambil.
bisa kah kamu aja kaku berkencan untuk makan malam besok;Bisakah kamu ajak aku berkencan untuk makan malam besok?
hey teman kamu minta anda pat membantu temu kan obat kesakitan ini;Hey teman, kamu minta aku dapat bantu temukan obat kesakitan ini.
jangan kau khawatir kan keraguan kita ber langsung menyelesaikan tugas ini;Jangan kau khawatir, keraguan kita berlangsung menyelesaikan tugas ini.
selamat pagi kaka pembicara ini berkaitan dengan topik ter kini;Selamat pagi, kaka, kita bicarai ini berkaitan dengan topik terkini.
jangan bawa bawa sakit anter akhir dalam percakapan kita lagi;Jangan bawa-bawa sakitan terakhir dalam percakapan kita lagi.
bisa kah kamu informasi kan jam selesai nya proses prosedur ini;Bisakah kamu informasikan jam selesai nya proses prosedur ini?
apa kah kamu memiliki waktu membantu konfirmasi kan jadwal mulai;Apakah kamu memiliki waktu membantu konfirmasikan jadwal mulai?
permisi kan terima undangan menghadiri beber apa perayaan besar;Permisi, terima undangan menghadiri beberapa perayaan besar.
cemas akan ingat kah aku laku kan hal ter sebut;Cemas akan ingatkah aku lakukan hal tersebut.
jangan kau ingat kan aku akan menyenangkan topik ter sebut lagi;Jangan kau ingatkan aku akan menyenangkan topik tersebut lagi.
apa kah kamu akan menu lis ulang esain koran ter bar udi area;Apakah kamu akan menulis ulang esain koran terbaru di area?
gimana kabarmu apa kah kamu sedang melakukan sesuatu yang menarik;Gimana kabarmu? Apakah kamu sedang melakukan sesuatu yang menarik?
tanya kan pada wakil dari bank apa kah kamu bisa membantu kup ada makanan ini;Tanyakan pada wakil dari bank, apakah kamu bisa membantu ku pada makanan ini?
mohon maaf apa kah aku men dapat kan salin dari buku ter baru temanku;Mohon maaf, apakah aku dapat salin dari buku terbaru temanku?
terima kasih atas bantu anmu pada proyek renovasi rumah kami;Terima kasih atas bantuannya pada proyek renovasi rumah kami.
bisa kah kamu aja kaku makan malam diluar untuk merayakan ber hasil nya projek ini;Bisakah kamu ajak aku makan malam diluar untuk merayakan berhasilnya proyek ini?
terima kasih banyak aku minta bantu anmu untuk mengatur acara keselamatan ini;Terima kasih banyak, aku minta bantuanmu untuk mengatur acara keselamatan ini.
bisa kah kamu ban tuaku men cari kan kata kunci penting dalam kehidupan ini;Bisakah kamu membantu aku mencari kunci penting dalam kehidupan ini?
apa kah aku men dapat kan saran mengenai tema mata kuliah yang baik untuk diambil;Apakah aku mendapatkan saran mengenai temamatkuliah yang baik untuk diambil?
apa kah kamu memiliki detail ten tang jam keberangkatan kereta ini;Apakah kamu memiliki detail tentang jam keberangkatan kereta ini?
apa nya angkot dari jakarta ibu kosan biasa sudah sampai disini;Apa yang angkot dari Jakarta ibu kosan biasa sudah sampai di sini?
bisa kah aku minta tolong kamu untuk membawakanku air minum;Bisakah aku minta tolong kamu untuk membawakanku air minum?
bisa kamu aja kaku keliling kota dalam rangka wisata kamu hari ini;Bisakah kamu ajak aku keliling kota dalam rangka wisata kamu hari ini?
apa kah kamu dapat menyimpan file ter sebut pada sekuan siapkanmu;Apakah kamu dapat menyimpan file tersebut pada sekuan siapkanmu?
maaf aku tidak ter lihat kamu ter lalu banyak waktu sekarang;Maaf aku tidak terlihat kamu terlalu banyak waktu sekarang.
apa kah kamu mau ikutke pesta oleh seorang teman baik kam udi akhir pekan;Apakah kamu mau ikut ke pesta oleh seorang teman baik kamu di akhir pekan?
bisa kah kamu member ikan saran ten tang rekomendasi lokasi makan ter baik;Bisakah kamu memberikan saran tentang rekomendasi lokasi makan terbaik?
apa aku per nah cerita hal itu kepadamu aku akan melupakanmu kam udi hati ini;Apa aku pernah cerita hal itu kepadamu? Aku akan melupakanmu di hati ini.
bisa kah kamu meminta salin denganku menguatkan kamu hari ini;Bisakah kamu minta salin dengan ku untuk menguatkan kamu hari ini?
maaf apa kah aku bisa minta tolongmu untuk mengisi ulang baterai handphone ini;Maaf, apakah aku bisa minta tolongmu untuk mengisi ulang baterai handphone ini?
bisa kah kamu membantu pilih bus yang akan langsung menuju kesembur;Bisakah kamu membantu pilih bus yang akan langsung menuju kesembur?
apa kah aku mengganggu kamu apa bila kamu sebentar lagi menelpon;Apakah aku mengganggu kamu apabila kamu sebentar lagi menelpon?
apa kah kamu akan menyiapkan hidangan spesial untuk acara keluarga besok;Apakah kamu akan menyiapkan hidangan spesial untuk acara keluarga besok?
terima kasih banyak aku menikmati waktu yang kamu ber ikan kepadaku;Terima kasih banyak, aku menikmati waktu yang kamu berikan padaku.
jangan lupa men jaga mobil kamu dengan baik set iap saat;Jangan lupa menjaga mobil kamu dengan baik setiap saat.
boleh kah aku menggunakan pulsa untuk menelepon sebentar saja;Bolehkah aku menggunakan pulsa untuk menelepon sebentar saja?
bisa kah kamu membantu ten tang cara memperbarui aplikasi ini;Bisakah kamu membantu tentang cara memperbarui aplikasi ini?
maaf apa kah aku dapat bantu anmu memahami materi presentasiku ini;Maaf, apakah aku dapat bantuanmu memahami materi presentasiku ini?
jangan khawatir aku sudah mengatur semu anya sampai apa kamu ter lihat;Jangan khawatir, aku sudah mengatur semuanya sampai apa kamu terlihat.
terima kasih aku member ikan waktu dan per hati anmu untuk kami semua;Terima kasih, kamu memberikan waktu dan perhatianmu untuk kami semua.
bisa kah kamu aja kaku untuk ber belanja sore ini;Bisakah kamu ajak aku untuk berbelanja sore ini?
apa kah aku dapat member ikan pendapat kritis untuk proyek ini kamu;Apakah aku dapat memberikan pendapat kritis untuk proyek ini kamu?
jangan lupa men anya kan informasi ten tang jam operasional tempat ini;Jangan lupa menanyakan informasi tentang jam operasional tempat ini.
bisa kah aku men cari sebuah acara yang menarik untuk dikunjungi besok ini;Bisakah aku mencari sebuah acara yang menarik untuk dikunjungi besok ini?
apa kah kamu tahu mengenai ter baru ten tang film ter kenal ini;Apakah kamu tahu mengenai terbaru tentang film terkenal ini?
terima kasih aku minta anda pat membantuku saat men cari tempat penyimpanan ini;Terima kasih, aku minta kamu dapat membantu ku saat mencari tempat penyimpanan ini.
maaf apa kah buku sudah ter lambat ini aku membutuhkan nya untuk proyek kuliah;Maaf, apakah buku sudah terlambat ini, aku membutuhkannya untuk proyek kuliah.
tanya kan kepada anak bimbingan belajar apa kah mereka sudah memahami materi hari ini;Tanyakan kepada anak bimbingan belajar, apakah mereka sudahmemahami materi hari ini?
apa kah kamu dapat membantu aku dalam memilih warna cat rumah baru ini;Apakah kamu dapat membantu aku dalam memilih warna cat rumah baru ini?
terima kasih atas penjelasan dari mengenai data per usahaan ini;Terima kasih atas penjelasan dari mengenai data perusahaan ini.
bisa kah kamu menemukan garu mobil api ter baik untu kak udi area ini;Bisakah kamu menemukan garu mobil api terbaik untuk aku di area ini?
apa kah kamu membantuku pengepakan bar ang bar ang untuk pindah rumah;Apakah kamu membantu ku pengepakan barang-barang untuk pindah rumah?
terima kasih atas ban tuan dari kamu membeli kan makanan saat aku ken yang sibuk;Terima kasih atas bantuan dari kamu membelikan makanan saat aku ken yang sibuk.
jam ber apa kah kamu akan sampai untuk per temuan ini;Jam berapa kamu akan sampai untuk pertemuan ini?
terima kasih banyak atas keteranganmu aku akan tinggal bersamamu;Terima kasih banyak atas keteranganmu, aku akan tinggal bersamamu.
apa kah aku mungkin untuk memindahkan janji membayar men jadi pekan ini;Apakah aku mungkin untuk memindahkan janji membayar menjadi pekan ini?
bisa kah kamu membantu ten tang cara meletakkan dokumen ini dalam folder;Bisakah kamu membantu tentang cara meletakkan dokumen ini dalam folder?
bisa kah aku meminta kirim bis ini untuk men jemput aku dari stasiun;Bisakah aku minta kirim bis ini untuk menjemput aku dari stasiun?
terima kasih aku dapat menghabiskan waktu ber sama dengan dirimu;Terima kasih aku dapat menghabiskan waktu bersama dengan dirimu.
bisa kah kamu membantu nya mengangkat kotak berat kemobil ini;Bisakah kamu membantunya mengangkat kotak berat ke mobil ini?
maaf apa kah aku bisa menunggu untuk beber apa menit lagi;Maaf, apakah aku bisa menunggu untuk beberapa menit lagi?
bisa kah aku minta tolong kam uji kaku membawa bar ang barangku;Bisakah aku minta tolong kamu jika aku membawa barang-barangku?
apa kah aku memperoleh izin untuk membuat proyek ini men jadi asli;Apakah aku memperoleh izin untuk membuat proyek ini menjadi asli?
bisa kah aku mengajukan permintaan untuk perubahan jadwal per temuan;Bisakah aku mengajukan permintaan untuk perubahan jadwal pertemuan?
hai apa kah kamu dapat men jelas kan prosedur pembelian bar ang ini;Hai, apakah kamu dapat menjelaskan prosedur pembelian barang ini?
maaf aku minta per hati anmu untuk sejenak ini;Maaf, aku minta perhatianmu untuk sejenak ini.
apa kah kamu akan menyediakan makanan ringan untuk per temuan besok;Apakah kamu akan menyediakan makanan ringan untuk pertemuan besok?
terima kasih banyak aku member ikan panduan kunjungan tempat ini;Terima kasih banyak, aku memberikan panduan kunjungan tempat ini.
jangan lupa membawa kan tanda buku melihat seminar ini kembali;Jangan lupa membawakan tanda buku melihat seminar ini kembali.
bisa kah aku meminjam tiket bis untuk per jalanan besok;Bisakah aku meminjam tiket bis untuk perjalanan besok?
apa kah kamu mengerti instruksi penggunaan per angkat ini;Apakah kamu mengerti instruksi penggunaan perangkat ini?
maaf apa kah aku bisa minta umpan balik dari kamu mengenai presentasiku;Maaf, apakah aku bisa minta umpan balik dari kamu mengenai presentasiku?
terima kasih aku dapat meluangkan waktu dan usaha untuk kami;Terima kasih, aku dapat meluangkan waktu dan usaha untuk kami.
jangan lupa men anya kan informasi lebih lanjut ten tang acara ini;Jangan lupa menanyakan informasi lebih lanjut tentang cara ini.
bisa kah aku membantu cara menggunakan aplikasi sosial media ini;Bisakah aku membantu cara menggunakan aplikasi sosial media ini?
maaf apa kah kamu tahu mengetahui detail terkait acara undangan ini;Maaf, apakah kamu tahu detail terkait acara undangan ini?
terima kasih aku minta pesanan pesanan darimu untuk membeli kan beli per alat andi;Terima kasih, aku minta pesanan pesanannya darimu untuk membelikan beli peralatan di sini.
bisa kah kamu aja kaku untuk makan malam pada restoran indian ter baik;Bisakah kamu ajak aku untuk makan malam pada restoran Indian terbaik?
apa kah kamu memiliki daftar resep puding coklat yang lezat ini;Apakah kamu memiliki daftar resep puding coklat yang lezat ini?
terima kasih banyak aku dapat mengandalkanmu dalam proyek ini besar;Terima kasih banyak, aku dapat mengandalkanmu dalam proyek ini besar.
jangan khawatir aku kan ingin kan saranmu untuk merancang taman rumahku;Jangan khawatir, aku ingin saranmu untuk merancang taman rumahku.
apa kah kamu memiliki ide cara menghias kue ulang tahun khusus untuk anak anak;Apakah kamu memiliki ide cara menghias kue ulang tahun khusus untuk anak-anak?
berita ini ter kini berkaitan erat dengan perubahan kebijakan pemerintah ini;Berita ini terkini berkaitan erat dengan perubahan kebijakan pemerintah ini.
tanya kan pada dokter apa kah aku percaya konsultasiku privatif dan aman;Tanyakan pada dokter, apakah aku percaya konsultasi ku privatif dan aman?
berita ini ter kini merupakan kisah nya ten tang pertunangan mereka senantiasa putus;Berita ini terkini merupakan kisah nyata tentang pertunangan mereka senantiasa putus.
tanya kan pada ibu kamu beri aku kunjungi sebentar untuk membantumu sakit perut;Tanyakan pada ibu, aku kunjungi sebentar untuk membantu mu sakit perut.
aku udah pena saran dengan cara mengatur keuanganku dengan baik;Aku sudah penasaran dengan cara mengatur keuanganku dengan baik.
terima kasih banyak atas bantu anku memilih warna yang cocok;Terima kasih banyak atas bantuanku memilih warna yang cocok.
maaf apa kah kamu bisa men jelas kan lagi ten tang proses ini;Maaf, apakah kamu bisa menjelaskan lagi tentang proses ini?
apa kah kamu mengerti instruksi dari pemerintah untuk lockdown;Apakah kamu mengerti instruksi dari pemerintah untuk lockdown?
maaf aku tidak bisa ber temu sebentar lagi kamu harus pulang;Maaf, aku tidak bisa bertemu sebentar lagi kamu harus pulang.
bisa kah kamu aja kaku untuk mengunjungi tempat wisata kamu yang favorit;Bisakah kamu ajak aku untuk mengunjungi tempat wisata kamu yang favorit?
terima kasih banyak kamu bantu dalam menyusun dan menyelesaikan presentasi;Terima kasih banyak, kamu bantudalam menyusun dan menyelesaikan presentasi.
jangan datangi ter lambat kamu mengganggu proses kerja orang lain;Jangan datang terlambat, kamu mengganggu proses kerja orang lain.
bisa kah kamu membantu saya men cari produk kosmetik yang alami;Bisakah kamu membantu saya mencari produk kosmetik yang alami?
maaf aku mohon apa kah kamu dapat member ikan komentar dan terhadap karyaku ini;Maaf, aku mohon, apakah kamu dapat memberikan komentar dan terhadap karyaku ini?
bisa kah kamu mengantarku sampai distrik bis nis ter dekat ini;Bisakah kamu mengantarku sampai distrik bisnis terdekat ini?
maaf apa kah kamu mau ikut ber sama dalam projek yang sama;Maaf, apakah kamu mau ikut bersama dalam projek yang sama?
terima kasih aku minta kamu dapat member ikan pendapat kritis dan masukan;Terima kasih, aku minta kamu dapat memberikan pendapat kritis dan masukan.
plis beri ban tuan sebentar lagi aku akan senang sekali;Tolong beri bantuan sebentar lagi, aku akan senang sekali.
maaf aku aku merasa gelisah apa kah kamu bisa memberikanku penjelasan;Maaf, aku merasa gelisah, apakah kamu bisa memberikan penjelasan?
terima kasih aku tidak ter tarik dengan aja kan ter sebut;Terima kasih, aku tidak tertarik dengan ajakan tersebut.
jangan khawatir kamu bis ata nya kan pertanyaan seputar tugas ini;Jangan khawatir, kamu bisa tanyakan pertanyaan seputar tugas ini.
bisa kah kamu aja kaku menonton film ter baru yang sedang tayang;Bisakah kamu ajak aku menonton film terbaru yang sedang tayang?
maaf aku tidak membawa buku catatan untuk per temuan kamu hari ini;Maaf, aku tidak membawa buku catatan untuk pertemuan kamu hari ini.
apa kah kamu akan menghadiri perayaan ulang tahun kamu ter sebut;Apakah kamu akan menghadiri perayaan ulang tahun kamu tersebut?
jangan lupa menyalin presentasiku untuk per temuan tanggal ber ikut nya;Jangan lupa menyalin presentasiku untuk pertemuan tanggal berikutnya.
terima kasih aku merasa pena saran untuk mengetahui surat itu;Terima kasih, aku merasa penasaran untuk mengetahui surat itu.
bisa kah kamu men jelas kan kembali instruksi sederhana untuk proyek ini;Bisakah kamu menjelaskan kembali instruksi sederhana untuk proyek ini?
maaf aku merepotkanmu untuk meminjam lap top tambahan;Maaf, aku merepotkanmu untuk meminjam laptop tambahan.
apa kah kamu bisa menemukan cara sepati saya dalam perayaan keluarga kamu;Apakah kamu bisa menemukan cara sepati saya dalam perayaan keluarga kamu?
terima kasih aku dapat menemukan waktu mengobrol sejenak;Terima kasih, aku dapat menemukan waktu mengobrol sejenak.
tanya kan pada guru bagaimana cara kurangi meningkat kan prestasi belajarku;Tanyakan pada guru, bagaimana cara kurangi meningkatkan prestasi belajarku?
maaf aku tidak dapat menghadiri per jaman kerja besok aku sedang tidak sedap badan;Maaf, aku tidak dapat menghadiri perjaman kerja besok. Aku sedang tidak sedap badan.
berita ini ter kini terkait dengan penangkapan seorang tersangka kriminal ber bahaya;Berita terkini terkait dengan penangkapan seorang tersangka kriminal berbahaya.
apa kah kamu mengerti instruksi pemasangan per angkat luna kini;Apakah kamu mengerti instruksi pemasangan perangkat lunak ini?
bisa kah kamu men jelas kan ten tang panduan penggunaan peralatan itu;Bisakah kamu menjelaskan tentang panduan penggunaan peralatan itu?
terima kasih banyak kamu merupakan orang ter baik dalam membantuku saat dalam kesulitan;Terima kasih banyak, kamu merupakan orang terbaik dalam membantu kami saat dalam kesulitan.
jangan kau khawatir aku akan men guru situ aku sudah memiliki pengalaman;Jangan kau khawatir, aku akanmengurus itu, aku sudah memilik pengalaman.
bisa kah kamu memberikanku saran program komputer ter baru yang bagus;Bisakah kamu memberikan saran program komputer terbaru yang bagus?
maaf apa kah aku meminta dukungan dan bantu anmu untuk proyek kami hari ini;Maaf, apakah aku dapat dukungan dan bantuanmu untuk proyek kami hari ini?
bisa kah kamu meminta foto kopi salin dokumen penting ini;Bisakah kamu meminta fotokopi salin dokumen penting ini?
apa kah kamu akan menyertai dalam acara sekarang ini;Apakah kamu akan menyertai dalam acara sekarang ini?
terima kasih atas waktu dan kesabaran nya mengajar kan kepada kami lagu slazim ini;Terima kasih atas waktu dan kesabarannya mengajarkan kepadakami lagu slazim ini.
apa kah aku men dapat mengajukan pertanyaan ten tang materi ini;Apakah aku dapat mengajukan pertanyaan tentang materi ini?
